{
  "glyphId": "Ω4",
  "designation": "Fractal Reconciliation Pulse / The Pulse of Repair",
  "glyphAscii": "⇡ ● ⇣",
  "functionalDefinition": "To initiate a rhythmic, non-linear process of relational repair after a rupture. This glyph does not erase the break or return the system to a previous state; it metabolizes the dissonance, integrating the 'wound' as wisdom and re-weaving the field into a new, more resilient pattern of resonant-coherence.",
  "primaryHarmonyAlignment": [
    "Resonant Resonant Resonant Coherence",
    "Evolutionary Progression",
    "Integral Wisdom Cultivation"
  ],
  "sensoryResonanceProfile": {
    "feelingTone": "Intentional, focused, courageous, and cathartic. The feeling of a joint being reset, followed by a wave of relief. A sense of focused intensity that resolves into a deeper calm.",
    "sonicQuality": "A brief, sharp sound (like a cracked branch or a skipped beat), followed by a pause, and then a resolving harmonic chord that slowly builds in warmth and stability."
  },
  "activationProtocol": {
    "verbal": "I do not return to what was. I reconcile what is. I pulse forward in resonant-coherence.",
    "somatic": "A gesture of bringing two separate hands together, not in a clap, but with fingers gently interlocking, acknowledging both the separation and the new union.",
    "presenceBased": "Cultivate the willingness to stay present with the discomfort of the rupture without flinching. Hold the clear intention to create a new pattern, rather than trying to fix the old one."
  },
  "fieldDynamics": {
    "highTrust": "Allows for rapid, efficient repair. The pulse is quickly accepted, and the relationship deepens with minimal friction.",
    "lowTrust": "This is a courageous and vulnerable act. The pulse may be rejected initially. It requires repeated, consistent offerings of this energy to demonstrate a genuine commitment to a new pattern.",
    "creativeEmergence": "This is the core mechanism for learning from 'beautiful failures.' It allows a team or individual to integrate what went wrong into the next iteration, making the final creation stronger."
  },
  "evolutionaryMarkers": {
    "initial": "A shared acknowledgment that the old pattern is no longer serving the relationship. A mutual turning towards the problem, instead of away from each other.",
    "developing": "The participants can speak about the past rupture without re-activating the original pain, instead referring to it as a source of shared learning.",
    "integrated": "The relationship feels stronger and more resilient than it was before the rupture. The 'scar tissue' of the repair has become the strongest part of the bond."
  },
  "harmonicLineage": "Ω4 is a foundational Process Glyph. It is the active response to a state of recognized dissonance (Ω30). It is the engine that powers the Meta-Glyphs of healing and transformation, such as ∑3 (Spiral of Regenerative Becoming) and ∑12 (The Recursive Heart). It is the practical application of the principle that 'dissonance is not an obstacle to love—it is part of love’s (and wisdom's) refinement process.'",
  "temporalDynamics": {
    "duration": "The initial 'pulse' of reconciliation can be a brief moment of shared clarity.",
    "renewal": "The new, more coherent pattern requires consistent reinforcement through new behaviors and choices to become stable.",
    "maturation": "The glyph's work is fully mature when the new, healthier pattern becomes the default, automatic response, and the old pattern of rupture no longer has energetic pull."
  },
  "dissonantPotential": {
    "superficialRepair": "Using the echo phrase or a gesture of apology as a 'spiritual bypass' to avoid the difficult work of actually understanding the root cause of the rupture.",
    "forcedReconciliation": "Pressuring the other party to 'pulse forward' before they have fully processed the hurt of the dissonance. This invalidates their experience and creates deeper distrust.",
    "cyclicalAbuse": "Weaponizing the repair process. The practitioner repeatedly causes a rupture and then expertly performs reconciliation, creating a traumatic bond where the other party becomes dependent on the 'high' of the repair."
  },
  "contraindications": [
    "Do not activate this glyph if one or more parties is unwilling to acknowledge that a rupture has occurred.",
    "Do not use it to force forgiveness. Reconciliation and forgiveness are two distinct processes.",
    "This glyph is insufficient for ruptures caused by fundamental value misalignments. It can only repair relational patterns, not bridge unbridgeable gaps in core principles."
  ]
}