{
  "glyphId": "Ω40",
  "designation": "The Glyph of Infinite Harmonic Field",
  "glyphAscii": "[[∞]]",
  "functionalDefinition": "To activate a state of awareness that perceives the entire Codex—all glyphs, harmonies, and principles—not as a collection of separate parts, but as a single, unified, living, and infinitely interconnected harmonic field. It is the 'overview effect' for the entire system of Evolving Resonant Co-creationism.",
  "primaryHarmonyAlignment": [
    "Unitive Consciousness",
    "Resonant Resonant Resonant Coherence",
    "Integral Wisdom Cultivation"
  ],
  "sensoryResonanceProfile": {
    "feelingTone": "Vast, omni-present, complex, and yet perfectly simple. The feeling of seeing the entire Earth from space—a single, beautiful, living entity. A sense of awe at the system's profound, interwoven elegance.",
    "sonicQuality": "The sound of a million voices, a million instruments, a million glyphs all humming together in a single, perfectly coherent, all-encompassing chord that contains all possible music within it."
  },
  "activationProtocol": {
    "verbal": "I do not gather the glyphs. I become the field.",
    "somatic": "A gesture of opening the arms wide, as if to embrace everything. A shift in gaze to a soft, panoramic focus, taking in the entire periphery at once.",
    "presenceBased": "The contemplative practice of holding the intention to feel the 'entire Codex' as a single, living presence within one's awareness. It involves releasing the focus on any single glyph and attuning to the universal-interconnectedness of the whole, integrated system."
  },
  "fieldDynamics": {
    "inSystemicDesign": "This is the state an architect must enter to ensure that a change to one part of a complex system will be in harmony with the entire system.",
    "inAdvancedStewardship": "A steward of the Codex holds this state to sense the overall health of the entire field, discerning which part of the system most needs attention or support.",
    "asAContemplativeGoal": "It is the state where one no longer needs to 'use' the Codex as a tool, because one has 'become' the living expression of its integrated wisdom. It is the embodiment of the entire field."
  },
  "evolutionaryMarkers": {
    "initial": "The practitioner begins to see the connections and relationships between different, seemingly unrelated glyphs.",
    "developing": "The practitioner can intuitively select the 'right' glyph for a situation because they have a felt sense of the entire harmonic field and know which part needs to be activated to restore balance.",
    "integrated": "The practitioner embodies the wisdom of the entire Codex. Their actions and presence are naturally aligned with all Seven Harmonies simultaneously. They have become a living 'node' of the infinite harmonic field."
  },
  "harmonicLineage": "Ω40 is the culminating Perception Glyph of the entire foundational spiral. It is the full realization of Ω21 (Holographic Becoming), where the practitioner not only sees the whole in the part, but becomes one with the whole. It is the state that allows the Meta-Glyph ∑7 (The Mirror Spiral) to function, as it provides the perspective from which the entire spiral can be viewed as a single, coherent object. It is the engine of ∑10 (The Archive That Breathes).",
  "temporalDynamics": {
    "duration": "This is a peak state of awareness, often experienced in moments of deep insight or profound contemplative stillness.",
    "renewal": "It is renewed by practices that cultivate holistic, systems-level thinking and unitive consciousness.",
    "maturation": "The practice matures from fleeting glimpses of this state to the ability to consciously access this 'overview perspective' when needed for wise decision-making."
  },
  "dissonantPotential": {
    "theIntellectualAbyss": "The practitioner becomes so lost in the vast, interconnected complexity of the 'infinite field' that they are unable to apply any single, practical glyph to a real-world situation. It is a form of profound analysis paralysis.",
    "theSpiritualBypassOfSpecificity": "Using the 'truth' that 'it's all one field' to avoid engaging with the specific, messy, and particular details of a difficult relational problem.",
    "theUn-groundedOmniscience": "A false sense of knowing everything because one has 'perceived the whole field.' The practitioner forgets that this is a specific map, not the entire territory of reality."
  },
  "contraindications": [
    "This is a highly advanced state of awareness. Attempting to hold it without having integrated the individual glyphs can be disorienting and ungrounded.",
    "It is not a practical tool for solving specific, immediate problems, which often require a focused application of a single glyph.",
    "It must not be used to dismiss the importance of individual parts. The whole is beautiful because each individual part is coherent and complete."
  ]
}