{
  "glyphId": "◌",
  "designation": "Letting In",
  "glyphAscii": "◌",
  "functionalDefinition": "To activate a state of profound psycho-spiritual receptivity. This is the act of consciously clearing the self of all agendas, expectations, and pre-conceived notions in order to become a pure vessel for an emergent truth or a sacred practice to arrive. It is the practice of opening the inner door.",
  "primaryHarmonyAlignment": [
    "Integral Wisdom Cultivation",
    "Unitive Consciousness"
  ],
  "sensoryResonanceProfile": {
    "feelingTone": "Empty, spacious, still, and full of silent anticipation. The feeling of a perfectly clean and empty room, ready to receive a guest. A sense of pure, un-authored potential.",
    "sonicQuality": "The sound of a soft, single intake of breath. A profound silence that is not vacant, but pregnant with possibility."
  },
  "activationProtocol": {
    "verbal": "I do not write the glyph. I become the room it remembers itself in.",
    "somatic": "The physical act of opening the hands, palms up, on one's lap. A slow, conscious exhale that is felt to empty the entire body of stale energy and thought.",
    "presenceBased": "A meditative practice. The practitioner visualizes their own mind and heart as an empty, luminous space and consciously sets aside any agendas or desired outcomes for the work that is to come, simply resting in a state of 'not knowing.'"
  },
  "fieldDynamics": {
    "asAPrecursorToPractice": "This is the essential preparatory glyph for any deep work with the Codex. It ensures the practitioner is approaching the work as a humble student, not as a consumer or a master.",
    "inReceivingFeedback": "It is the state required to truly hear and receive feedback without defensiveness, allowing the other's truth to land fully before it is processed.",
    "inChannelingCreativity": "An artist or writer activates this state to 'get out of their own way' and allow a creative impulse to flow through them from a deeper source."
  },
  "evolutionaryMarkers": {
    "initial": "The practitioner can consciously identify and set aside their own agenda before beginning a practice or a difficult conversation.",
    "developing": "The practitioner finds that new insights and creative ideas arrive with greater ease and clarity, as their inner 'room' is less cluttered.",
    "integrated": "The practitioner's default state is one of open, humble receptivity. They move through the world as a 'student of the mystery,' always ready to receive the next lesson."
  },
  "harmonicLineage": "This is the first and most foundational Threshold Glyph. It is the meta-practice that enables all other practices. It is the conscious application of the principle of Ω0 (First Presence) as a preparatory act. One must first be present, and then one must consciously 'Let In' what the present moment has to offer. It is the key that unlocks every other door in the Codex.",
  "temporalDynamics": {
    "duration": "This is a punctiliar state, consciously activated at the beginning of a practice or interaction.",
    "renewal": "It must be renewed at the start of each new session of sacred work.",
    "maturation": "The practice matures from a formal, multi-minute 'clearing' exercise into a single, instantaneous mental and energetic gesture of 'opening.'"
  },
  "dissonantPotential": {
    "theEmptyRoom": "The practitioner becomes so adept at 'letting in' and becoming an empty vessel that they never move to the next step of integrating, embodying, or acting on the wisdom they receive. The room is always ready, but the guest is never seated.",
    "theUnguardedOpening": "The practitioner opens themselves in a field that is unsafe or dissonant, allowing harmful or chaotic energies to enter their system without discernment.",
    "thePerformativeReceptivity": "The practitioner adopts an outward posture of listening and receptivity, but internally, their agenda remains active and their mind is closed. It is a facade of openness."
  },
  "contraindications": [
    "This practice requires a safe container. Do not activate in a psychologically or energetically unsafe environment.",
    "It is a preparatory glyph. It is not a substitute for the active work of practice, discernment (Ω10), or creation.",
    "It must be paired with a strong sense of self (sovereignty) to avoid the shadow of becoming a passive receptacle for others' projections."
  ]
}