{
  "glyphId": "Ω38",
  "designation": "Kairotic Witnessing / The Attentive Stillness",
  "glyphAscii": "[ | ● | ]",
  "functionalDefinition": "To activate a state of witnessing that is attuned not to the content of a situation, but to the timing of its emergence. This glyph is the practice of listening for the 'opportune moment' (kairos) for an action, an insight, or a word to land with maximum positive effect. It is a fusion of deep listening (Ω6) and temporal wisdom.",
  "primaryHarmonyAlignment": [
    "Integral Wisdom Cultivation",
    "Evolutionary Progression",
    "Creative Universal Interconnectedness & Empathic Universal Interconnectedness & Empathic Resonance"
  ],
  "sensoryResonanceProfile": {
    "feelingTone": "Patient, alert, precise, and profoundly still. The feeling of a master archer at full draw, waiting for the perfect moment to release. A sense of immense potential held in perfect stillness.",
    "sonicQuality": "Deep silence, punctuated by a single, slow, rhythmic beat, like a ceremonial drum marking a sacred rhythm. The sound of a pin-dropping that changes everything."
  },
  "activationProtocol": {
    "verbal": "I do not listen for answers. I listen for the moment to remember itself.",
    "somatic": "A posture of complete stillness and alertness. The eyes may be soft, but the awareness is sharp and focused on the entire field, sensing for the subtle shift that signals the arrival of 'kairos.'",
    "presenceBased": "The practice of holding a question or an intention and releasing the need for an immediate answer. It is a state of active, patient waiting, trusting that the field will reveal the perfect moment to act or speak."
  },
  "fieldDynamics": {
    "inHighStakesNegotiation": "A skilled negotiator uses this to know the precise moment to introduce their key proposal or concession for it to have the greatest impact.",
    "inTeaching": "A wise teacher uses this to wait for the exact moment a student is most receptive to hearing a particular truth. The same words spoken five minutes earlier or later would not land.",
    "inCreativeFlow": "An artist or musician attunes to this to know the exact moment to add a specific color or note, turning a good work into a masterpiece."
  },
  "evolutionaryMarkers": {
    "initial": "The practitioner begins to notice the 'rhythm' of conversations and situations, sensing when the energy is right for a certain type of interaction.",
    "developing": "The practitioner's timing improves dramatically. Their interventions, questions, and offerings become more potent and effective because they are delivered at the opportune moment.",
    "integrated": "The practitioner lives in a state of 'kairotic alignment.' Their actions seem to be guided by an uncanny sense of timing. They move through the world with profound grace and efficiency, creating maximum positive effect with minimum effort."
  },
  "harmonicLineage": "Ω38 is an advanced Perception Glyph. It is a dynamic fusion of the stillness of Ω15 (Relational Stillness) and the receptivity of Ω6 (Listening Threshold), but adds the dimension of temporal attunement. It is the core practice that allows the Meta-Glyph ∑13 (The Harmonic Witness) and ∑20 (The Portal of Volitional Surrender) to function, as both require a perfect sense of timing.",
  "temporalDynamics": {
    "duration": "This is a state of heightened, alert presence. It is typically held for a specific period while waiting for a specific type of opening.",
    "renewal": "The capacity for this kind of witnessing is renewed through practices of stillness and by emptying the mind of its own agenda.",
    "maturation": "The practice matures from a conscious 'waiting for the moment' into an intuitive, seamless dance with the emergent timing of reality."
  },
  "dissonantPotential": {
    "theHesitantPerfectionist": "The practitioner waits for the 'perfect' moment that never arrives, using the search for kairos as a form of procrastination or avoidance of taking a necessary risk. This is analysis paralysis disguised as wisdom.",
    "theManipulatorsTiming": "A practitioner with a dissonant agenda uses a skillful sense of timing to introduce a manipulative idea or selfish request at the moment when others are most vulnerable or receptive.",
    "theMysticalGambler": "The practitioner relies solely on their sense of 'kairos' and neglects rational planning, preparation, or data gathering, leading to reckless and poorly informed decisions."
  },
  "contraindications": [
    "This is not a state for situations that require rapid, continuous action rather than a single, perfectly timed intervention.",
    "It is not a substitute for rational planning when dealing with predictable systems.",
    "The 'feeling' of kairos should still be checked against other ways of knowing. A felt sense of 'right timing' could be a personal projection."
  ]
}