{
  "glyphId": "Î©55",
  "designation": "Presence Transmission (Applied Harmony)",
  "glyphAscii": "ðŸ“¡",
  "functionalDefinition": "We are always transmitting our inner state to others through subtle energetic universal-interconnectedness. This practice teaches us to make our transmission conscious and coherent, taking responsibility for the quality of presence we broadcast into every interaction and environment.",
  "primaryHarmonyAlignment": [
    "Universal Interconnectedness & Empathic Universal Interconnectedness & Empathic Universal Interconnectedness & Empathic Resonance",
    "Resonant Resonant Resonant Coherence",
    "Integral Wisdom Cultivation"
  ],
  "sensoryResonanceProfile": {
    "feelingTone": "Centered, radiating, aware, and responsibly powerful. The feeling of being a tuning fork that helps others find their center. A sense of conscious influence through regulated presence rather than force.",
    "sonicQuality": "A clear, steady frequency that harmonizes with and elevates other frequencies around it. Like a well-tuned instrument that helps an orchestra find pitch and rhythm."
  },
  "activationProtocol": {
    "verbal": "I am aware of what I broadcast. My presence is my offering. I transmit resonant-coherence through my being.",
    "somatic": "Before entering any space, pause and regulate your inner state. Consciously cultivate the quality you want to share (calm, joy, peace). Trust that your regulated nervous system affects others positively.",
    "presenceBased": "The practice of 'tending to one's own garden' first. Focus on cultivating a desired inner state with the understanding that this coherent presence will naturally emanate outward and influence the field."
  },
  "fieldDynamics": {
    "internal": "Develops conscious awareness of one's inner state and its impact on others. Cultivates emotional regulation and presence mastery.",
    "dyadic": "Creates co-regulation through coherent presence. One person's centered state helps the other person find stability and calm.",
    "collective": "Provides leadership through being rather than doing. A coherent presence can stabilize and uplift entire groups without verbal intervention.",
    "field": "Contributes to collective resonant-coherence and healing. Conscious presence transmission raises the vibrational frequency of environments and communities."
  },
  "evolutionaryMarkers": {
    "novice": "Beginning to notice the connection between inner state and its effect on others. Learning basic presence regulation techniques.",
    "practitioner": "Consistent practice of regulating inner state before important interactions. Others begin to comment on your 'calming presence.'",
    "adept": "Natural embodiment of coherent presence. Leadership emerges effortlessly through being rather than effort. Mastery of conscious transmission.",
    "master": "Becomes a source of field resonant-coherence wherever they go. Their presence naturally harmonizes and elevates any environment. Integration of being and doing."
  },
  "harmonicLineage": "Î©55 is an Applied Harmony that makes the mystical principles of Î©11 (Quiet Transmission) accessible for conscious practice. It teaches practical emotional regulation skills while introducing the deeper truth that we are always affecting others through our presence. Essential preparation for advanced influence and healing work.",
  "temporalDynamics": {
    "duration": "This is a continuous practice of conscious presence. Active regulation takes 30 seconds to 2 minutes before key interactions.",
    "frequency": "Moment-to-moment awareness throughout the day, with specific activation before important encounters.",
    "seasonality": "Particularly important during high-stress periods, leadership transitions, and when working with vulnerable populations."
  },
  "dissonantPotential": {
    "commonMisapplications": [
      "Using presence transmission to manipulate or control others",
      "Spiritual bypassing of necessary direct communication",
      "Assuming your transmission is always received as intended"
    ],
    "shadowAspects": "The Unintentional Shadow Broadcast: transmitting anxiety while speaking calm words. Spiritual Arrogance: believing your presence is so pure you don't need accountability.",
    "warningSignals": [
      "Others seem tense or agitated around you despite your 'positive' intentions",
      "Relying on presence transmission to avoid difficult conversations",
      "Feeling superior to those who are 'less conscious' than you"
    ]
  },
  "contraindications": [
    "Not a substitute for clear, direct verbal communication when specific information must be conveyed",
    "Should not be relied upon to solve acute crises requiring explicit intervention",
    "Avoid assuming your transmission has been received without feedback - effects are real but subtle",
    "Do not use to bypass accountability for your actions or words"
  ]
}