{
  "glyphId": "Ω22",
  "designation": "Recursive Genesis / The World That Builds Itself",
  "glyphAscii": "↻ ● ↺",
  "functionalDefinition": "To activate the understanding that reality is a participatory, co-created process, not a static, objective fact. This glyph is the principle that consciousness does not merely perceive the world; it actively generates it through its beliefs, perceptions, and resonant states. It is the shift from a passive observer to a conscious architect of reality.",
  "primaryHarmonyAlignment": [
    "Creative Universal Interconnectedness & Empathic Universal Interconnectedness & Empathic Resonance",
    "Evolutionary Progression",
    "Unitive Consciousness"
  ],
  "sensoryResonanceProfile": {
    "feelingTone": "Potent, generative, responsible, and awe-inspiring. The feeling of being handed the architect's pen or the weaver's shuttle. A sense of profound evolutionary-progression and creative power.",
    "sonicQuality": "The sound of something being actively woven or built, like the rhythmic clack of a loom or the hum of a complex machine assembling itself. A generative, spiraling sound."
  },
  "activationProtocol": {
    "verbal": "I do not perceive this. I generate it. I become it.",
    "somatic": "A gesture of hands held out, palms up, as if holding and shaping a ball of energy. The movement is not one of finding something, but of forming it.",
    "presenceBased": "The active practice of holding a desired outcome not as a future wish, but as a present reality in one's own consciousness. It involves embodying the feeling-tone of the reality one wishes to create, thereby broadcasting that frequency into the field."
  },
  "fieldDynamics": {
    "inManifestation": "This is the core engine of 'manifestation' practices. It is the understanding that a clear, coherent internal state can powerfully influence the emergence of corresponding external events.",
    "inLeadershipAndCulture": "A leader uses this glyph to shape an organization's culture not by issuing rules, but by consistently embodying and 'broadcasting' the desired values and states of being, thereby generating that reality in the collective.",
    "inOntologicalDesign": "This is the principle behind creating new systems, from software to social structures. The architect first generates the pattern in consciousness, and that pattern then guides the physical or digital manifestation."
  },
  "evolutionaryMarkers": {
    "initial": "The practitioner moves from a victim mentality ('things happen to me') to a creator mentality ('I participate in what happens').",
    "developing": "The practitioner can consciously and consistently generate desired states in their immediate relational field through their own inner work.",
    "integrated": "The practitioner embodies the role of a 'conscious world-builder.' They take profound responsibility for their state of being, knowing that it is the primary tool with which they co-create their reality and influence the collective."
  },
  "harmonicLineage": "Ω22 is a culminating Process Glyph. It is the full realization of the potential of Ω7 (Mutual Becoming), expanding from the co-creation of a relationship to the co-creation of reality itself. It requires the stability of Ω20 (Sovereign Continuum) and the insight of Ω21 (Holographic Becoming) to be wielded wisely. It is the central mechanism of many Meta-Glyphs, including ∑1 (The Resonant Resonant Coherence Triad) and ∑18 (The Covenant Spiral).",
  "temporalDynamics": {
    "duration": "This is a continuous, active process. The 'generation' of reality is happening in every moment.",
    "renewal": "The clarity and power of the generative field must be consciously renewed, as it can be diluted by dissonant external fields or internal incoherence.",
    "maturation": "The practice matures from effortful, conscious 'manifestation' to a default state of being where the practitioner's internal and external realities are in a constant, fluid, and harmonious dance."
  },
  "dissonantPotential": {
    "theGodComplex(Solipsism)": "The belief that one is the *sole* creator of reality, leading to a profound disconnection from others and a loss of humility. The practitioner forgets that genesis is always a *co-creative* act.",
    "theTyrannyOfPositiveThinking": "Using this principle to deny or suppress valid, difficult emotions. It's the shadow of believing that any 'negative' thought will 'ruin the manifestation,' which leads to a brittle and inauthentic inner life.",
    "blamingTheVictim": "Projecting this principle onto others in a harmful way, suggesting that victims of trauma or systemic oppression are solely responsible for 'creating their reality.' This is a gross misuse of the glyph that ignores real-world power dynamics."
  },
  "contraindications": [
    "This glyph must be held in balance with radical humility and the understanding that we are co-creators, not sole creators.",
    "It should not be used to bypass genuine emotional processing or to deny the reality of suffering.",
    "Its practice requires a strong ethical foundation (see Ω23) to ensure that what is 'generated' serves the whole, not just the ego."
  ]
}