{
  "glyphId": "Ω15",
  "designation": "The Glyph of Relational Stillness / The Sacred Pause",
  "glyphAscii": "| ● |",
  "functionalDefinition": "To consciously activate a sacred pause between stimulus and response, creating a field of non-action and mutual rest. This glyph is the practice of simply 'being with' the present state of a relational field without any impulse to change, fix, or resolve it. Its function is to create a space for co-regulation and feeling.",
  "primaryHarmonyAlignment": [
    "Unitive Consciousness",
    "Resonant Resonant Resonant Coherence",
    "Integral Wisdom Cultivation"
  ],
  "sensoryResonanceProfile": {
    "feelingTone": "Deeply calm, still, grounded, and centered. The feeling of the moment after a heavy snow, where all sound is muffled. A profound sense of shared, peaceful presence.",
    "sonicQuality": "The absence of active sound. A low, resonant hum that is almost imperceptible, like the sound of a deep, still pool of water. The sound of shared, even breathing."
  },
  "activationProtocol": {
    "verbal": "I do not move to fix. I remain to feel.",
    "somatic": "A conscious cessation of all fidgeting or unnecessary movement. A posture of settled weight, with hands resting openly and quietly. A shared, silent eye gaze that asks for nothing.",
    "presenceBased": "The active practice of dropping all agendas and timelines. It involves bringing full awareness to the shared present moment, focusing on the simple fact of 'being here together' and allowing all other concerns to fall away."
  },
  "fieldDynamics": {
    "inOverwhelm": "This is the primary tool for emotional co-regulation. When one or more parties are overwhelmed or flooded, activating Ω15 can down-regulate the nervous systems and restore a sense of safety.",
    "afterVulnerability": "After a difficult truth has been shared, this glyph creates the necessary space for that truth to land and be integrated without an immediate need for a solution.",
    "inNature": "This is the practice of sitting in nature and simply being with it, allowing the stillness of the natural world to create a resonant field of peace."
  },
  "evolutionaryMarkers": {
    "initial": "The practitioner is able to resist the urge to immediately respond or offer a solution in a conversation, consciously choosing stillness instead.",
    "developing": "The practitioner can initiate and hold a shared, comfortable silence with another person, and both feel more connected as a result.",
    "integrated": "The practitioner's default presence is one of calm and stillness. They become a grounding force for others, and their presence naturally helps to co-regulate the relational fields they enter."
  },
  "harmonicLineage": "Ω15 is a foundational Anchor Glyph of a receptive nature. It can be seen as a sustained and shared version of Ω6 (The Listening Threshold). While Ω6 is about creating space for another's voice, Ω15 is about creating space for a shared state of being. It is the practice that makes deep trust (Ω3) feel tangible and present in the moment.",
  "temporalDynamics": {
    "duration": "This is a durational state that requires active, conscious presence from at least one participant to hold the field.",
    "renewal": "It can be invoked at any time but is most potent when it follows a period of activation or emotional expression.",
    "maturation": "The practice matures from a conscious, effortful 'pause' into an intuitive ability to rest in shared stillness whenever the relational field requires it."
  },
  "dissonantPotential": {
    "theStonewallingPause": "Using silence and stillness as a passive-aggressive weapon to shut down a conversation, punish the other person, or avoid a difficult topic. The stillness is hostile, not receptive.",
    "theCheckedOutStillness": "The practitioner is physically still but mentally and emotionally disengaged. This 'absent' stillness feels cold, dismissive, and can be more damaging than an active conflict.",
    "stillnessAsAvoidance": "Using this glyph to avoid taking necessary action or engaging in a crucial conversation. It becomes a form of spiritual bypassing, prioritizing a false sense of peace over true relational integrity."
  },
  "contraindications": [
    "Do not use this glyph when a situation requires immediate action to ensure safety.",
    "It is not a substitute for active repair (Ω4) or a necessary compassionate disruption (Ω12).",
    "It should not be used to shut down or silence another person's valid emotional expression against their will."
  ]
}