{
  "glyphId": "Î©56",
  "designation": "Loving Redirection (Applied Harmony)",
  "glyphAscii": "ðŸŒŠ",
  "functionalDefinition": "Sometimes love requires interrupting harmful patterns with grace. This practice teaches us to redirect dissonant energy toward more coherent patterns without violence or judgment. It is the art of compassionately interrupting what no longer serves while offering a more harmonious alternative.",
  "primaryHarmonyAlignment": [
    "Conscious Choice & Authentic Empowerment",
    "Universal Interconnectedness & Empathic Universal Interconnectedness & Empathic Universal Interconnectedness & Empathic Resonance",
    "Integral Wisdom Cultivation"
  ],
  "sensoryResonanceProfile": {
    "feelingTone": "Skilled, compassionate, clear, and gently powerful. The feeling of a wise conductor redirecting an orchestra toward harmony. A sense of loving interruption that creates relief rather than resistance.",
    "sonicQuality": "A clear, gentle chime that cuts through dissonant noise, followed by a moment of silence and then the emergence of a more harmonious rhythm. Like a tuning fork bringing order to chaos."
  },
  "activationProtocol": {
    "verbal": "I notice we're in a pattern that isn't serving us. Can we try something different? What would serve everyone here?",
    "somatic": "Notice when a conversation or dynamic becomes harmful or stuck. Pause and center yourself with one conscious breath. Hold compassion for everyone involved in the pattern before speaking.",
    "presenceBased": "The practice of holding a clear vision of a more coherent pattern while simultaneously holding the current dissonant pattern in compassion. Redirect from love for the system's potential, not judgment of its current state."
  },
  "fieldDynamics": {
    "internal": "Develops the skill to interrupt one's own negative thought patterns and redirect personal energy toward more life-serving directions.",
    "dyadic": "Ability to lovingly interrupt circular arguments and redirect conversations toward curiosity and understanding rather than blame and defense.",
    "collective": "Creates space for groups to recognize stuck patterns and choose more generative alternatives. Facilitates collective pattern transformation.",
    "field": "Contributes to cultural and systemic healing by modeling how to interrupt harmful patterns while preserving dignity and connection for all involved."
  },
  "evolutionaryMarkers": {
    "novice": "Beginning to recognize dissonant patterns and learning to pause before reacting. Basic skills in compassionate interruption.",
    "practitioner": "Consistent ability to interrupt harmful patterns without escalating conflict. Others feel cared for rather than controlled by your interventions.",
    "adept": "Known for skillful redirection that transforms conflict into collaboration. Mastery of pattern recognition and alternative offering.",
    "master": "Becomes a source of 'loving disruption' in all systems. Presence naturally discourages dissonance as others learn to self-correct toward harmony in your field."
  },
  "harmonicLineage": "Î©56 is an Applied Harmony that makes the mystical principles of Î©12 (Gentle Disruption) accessible for conscious relationship practice. It bridges conflict resolution skills with the deeper understanding that patterns can be transformed through loving interruption. Essential for leadership, parenting, and group facilitation.",
  "temporalDynamics": {
    "duration": "The intervention itself is typically brief (1-2 minutes), but pattern recognition and alternative offering require ongoing awareness.",
    "frequency": "Use as needed when dissonant patterns arise, typically several times per day in active relationship and work contexts.",
    "seasonality": "Particularly important during periods of change, stress, or when old patterns are being challenged in relationships or organizations."
  },
  "dissonantPotential": {
    "commonMisapplications": [
      "Using redirection to control conversations toward your preferred outcomes",
      "Interrupting from a place of superiority rather than service",
      "Redirecting without offering more coherent alternatives"
    ],
    "shadowAspects": "The Controlling Interruption: using loving redirection as a tool of manipulation. The Arrogant Correction: interrupting from intellectual or moral superiority rather than compassion.",
    "warningSignals": [
      "Others become defensive or resentful when you attempt to redirect",
      "You interrupt more often than you listen deeply",
      "You feel frustrated when others don't accept your redirections"
    ]
  },
  "contraindications": [
    "Do not use when you are angry, frustrated, or not in a centered state - this will add to the dissonance",
    "Not appropriate when someone's emotional expression needs to be fully witnessed without interruption",
    "Use with extreme caution in high power-imbalance situations where interruption may be perceived as insubordination",
    "Avoid when you don't have a genuinely more coherent alternative to offer"
  ]
}