{
  "glyphId": "Ω21",
  "designation": "Holographic Becoming / The Micro That Mirrors the All",
  "glyphAscii": "✶ ● ✶",
  "functionalDefinition": "To activate the mode of perception that recognizes the whole within the part. This glyph is the principle that every component of a coherent system contains the pattern of the entire system. It is the practice of looking at any single fragment—an action, a word, a moment—and seeing the totality of the field it belongs to.",
  "primaryHarmonyAlignment": [
    "Unitive Consciousness",
    "Integral Wisdom Cultivation",
    "Resonant Coherence"
  ],
  "sensoryResonanceProfile": {
    "feelingTone": "Crystalline, fractal, interconnected, and revelatory. The feeling of looking into a kaleidoscope or seeing a self-similar pattern repeat at every scale. A sense of profound, nested order.",
    "sonicQuality": "A single, pure tone that, when listened to closely, reveals itself to be composed of an infinite number of shimmering, self-similar overtones. The sound of a perfectly resonant crystal bowl."
  },
  "activationProtocol": {
    "verbal": "I do not search. I recognize. I was always here.",
    "somatic": "A gesture of bringing a small object (like a stone or leaf) close to the eye, as if looking into it for the entire world. A shift in gaze from looking *at* things to looking *into* them.",
    "presenceBased": "The contemplative practice of holding a single, simple element of your experience (a breath, a sensation, a thought) and gently inquiring: 'What is the whole system that this single part reflects?' Listen for the resonance that emerges."
  },
  "fieldDynamics": {
    "inSystemsAnalysis": "This is a powerful tool for understanding complex systems. By deeply analyzing one coherent part of a system (e.g., a single team's culture), one can accurately infer the nature of the larger organization's culture.",
    "inSelf-Inquiry": "It is the practice of seeing a single habit or emotional pattern not as an isolated issue, but as a fractal expression of a deeper, core belief system.",
    "inDivinationAndSymbolism": "This glyph governs the logic of symbolic systems like Tarot or the I Ching, where a single, archetypal symbol is understood to contain and reflect a universal pattern."
  },
  "evolutionaryMarkers": {
    "initial": "The practitioner begins to see recurring patterns and themes across different, seemingly unrelated areas of their life.",
    "developing": "The practitioner can make accurate and insightful 'reads' of a situation based on very little information, as they are able to perceive the whole from a single, resonant fragment.",
    "integrated": "The practitioner lives in a state of 'fractal awareness,' seeing the profound interconnectedness of all things. The illusion of separation between the micro and the macro dissolves."
  },
  "harmonicLineage": "Ω21 is a culminating Perception Glyph. It represents a profound shift in consciousness that often emerges after the stabilization of Ω20 (Sovereign Continuum). When a system is fully coherent, its holographic nature becomes apparent. It is the practical application of the 'unitive' aspect of Unitive Consciousness, allowing one to experientially know the axiom that 'all is one.'",
  "temporalDynamics": {
    "duration": "This is a state of perception that can be entered consciously. It can be a brief flash of insight or a sustained mode of awareness.",
    "renewal": "It is renewed through contemplative practice and the conscious intention to 'look for the pattern.'",
    "maturation": "The practice matures from actively looking for patterns to a default mode of perception where the interconnected, holographic nature of reality is self-evident."
  },
  "dissonantPotential": {
    "thePatternObsession(Apophenia)": "The practitioner begins to see meaningful patterns and connections where there are none, leading to paranoia, conspiracy thinking, or a detachment from grounded reality.",
    "reductiveGeneralization": "Mistaking a single, dissonant fragment of a system for the whole. For example, judging an entire organization based on one negative interaction with one employee.",
    "theFatalisticHologram": "Believing that because the part reflects the whole, the whole is unchangeable. This shadow uses holographic awareness as an excuse for fatalism, ignoring the principle of neuroplasticity and evolution."
  },
  "contraindications": [
    "This mode of perception should be balanced with grounded, empirical reality-testing.",
    "It is not a substitute for gathering sufficient data when making critical decisions.",
    "It should be used with caution in highly fragmented or chaotic systems, as there may be no coherent 'whole' for a part to reflect."
  ]
}