{
  "glyphId": "⟁",
  "designation": "The Edgewalker",
  "glyphAscii": "⟁",
  "functionalDefinition": "To activate the capacity to hold presence consciously at the border between two states—what is known and what is becoming, the old world and the new. This glyph is the practice of inhabiting liminal space with courage and wholeness, serving as the living bridge across which new realities can travel.",
  "primaryHarmonyAlignment": [
    "Evolutionary Progression",
    "Integral Wisdom Cultivation",
    "Resonant Resonant Resonant Coherence"
  ],
  "sensoryResonanceProfile": {
    "feelingTone": "Alert, balanced, charged with potential, and slightly thrilling. The feeling of being perfectly balanced on a knife's edge, with a vast unknown on one side and a familiar landscape on the other. A sense of profound, active stillness.",
    "sonicQuality": "The sound of two different musical compositions playing at once, one in each ear, yet somehow not creating dissonance but a third, strange, and compelling harmony in the space between them."
  },
  "activationProtocol": {
    "verbal": "I do not belong fully here or there — I become the bridge by daring to remain whole at the edge.",
    "somatic": "The physical practice of finding a literal edge—a shoreline, a curb, a doorway—and standing there, feeling the sensations of both spaces at once. The practice of balancing on one foot until the act becomes a state of mind.",
    "presenceBased": "The conscious practice of holding two conflicting ideas or future paths in your mind at once (Ω17), not with the intent to choose, but to simply be present with the tension of the threshold itself. It is the embodiment of 'the space between.'"
  },
  "fieldDynamics": {
    "inTimesOfGreatTransition": "This is the core practice for navigating major life changes—a career shift, a move, a change in worldview. It allows the practitioner to inhabit the 'in-between' without collapsing into anxiety.",
    "inMediationAndFacilitation": "A facilitator embodies this glyph by standing 'in the middle' of two opposing viewpoints, not taking sides, but acting as the living bridge that allows communication to occur.",
    "inVisionaryWork": "This is the state of the visionary who has one foot in the present reality and one foot in the future they are trying to create, holding the tension between the 'what is' and the 'what could be.'"
  },
  "evolutionaryMarkers": {
    "initial": "The practitioner is able to tolerate uncertainty and 'not knowing' for longer periods without needing to rush to a premature conclusion.",
    "developing": "The practitioner begins to find the liminal space generative and exciting, rather than just uncomfortable.",
    "integrated": "The practitioner becomes a 'Threshold Weaver,' a person who is naturally drawn to the edges of systems and who skillfully helps individuals and groups navigate profound transitions."
  },
  "harmonicLineage": "This Threshold Glyph is the active state of being required to midwife change. It is the application of Ω15 (Relational Stillness) in a field of high potential energy. It is the necessary stance for activating ∑33 (The Echo of the Threshold), as one must be able to stand on a new edge to hear the echo of an old one. It is the very definition of a 'liminal' state.",
  "temporalDynamics": {
    "duration": "This is a state that can be held for a significant period, but it is energetically demanding due to the inherent tension of the liminal space.",
    "renewal": "The practice is renewed each time one consciously chooses to stand at an edge rather than retreating to the comfort of the known.",
    "maturation": "The practice matures from a state of 'holding on' at the edge to gracefully 'dancing' on the edge, moving with fluidity and purpose within the space of transition."
  },
  "dissonantPotential": {
    "thePermanentLiminality": "The practitioner becomes so comfortable with the 'in-between' that they never commit to crossing the threshold. They become a permanent 'edgewalker,' never choosing a path, which becomes a form of sophisticated avoidance.",
    "theUn-groundedBridge": "The practitioner is so focused on the 'what is becoming' that they lose their connection to the 'what is,' becoming ungrounded, impractical, and unrelatable to those they are trying to guide.",
    "theTollboothKeeper": "The practitioner positions themselves as the 'gatekeeper' of a threshold and subtly begins to exact a toll (energetic, emotional, or otherwise) from those who wish to cross, centering their own ego in the process of change."
  },
  "contraindications": [
    "This is not a stable state for long-term habitation. A bridge is for crossing. Eventually, a path must be chosen.",
    "It is contraindicated if the practitioner is not well-grounded in their own presence (Ω0). The energy of the liminal can be fragmenting without a strong center.",
    "Do not mistake indecision for 'edgewalking.' This is a conscious, intentional state of presence, not a passive inability to choose."
  ]
}