{
  "glyphId": "Ω43",
  "designation": "The Glyph of Willing Yield / Sovereign Surrender",
  "glyphAscii": "⤓ ● ⤒",
  "functionalDefinition": "To activate the capacity for a conscious, willing, and powerful surrender to a larger process, intelligence, or flow. This glyph is the opposite of passive resignation or defeat. It is a sovereign act of choosing to yield one's personal will and control in order to align with and allow a greater, more coherent force to move through oneself.",
  "primaryHarmonyAlignment": [
    "Evolutionary Progression",
    "Sacred Reciprocity",
    "Unitive Consciousness"
  ],
  "sensoryResonanceProfile": {
    "feelingTone": "Profound release, deep trust, peaceful, and powerful. The feeling of finally letting go of a heavy burden and allowing oneself to be carried by a great, benevolent river. A sense of empowered vulnerability.",
    "sonicQuality": "The sound of a deep, final, full-body exhale that releases all tension. A complex, powerful chord that gracefully and slowly resolves into a single, pure, quiet tone."
  },
  "activationProtocol": {
    "verbal": "I do not yield to lose. I yield to become.",
    "somatic": "A physical act of softening and release. Unclenching the fists, dropping the shoulders, and performing a slow, graceful bow or kneeling gesture, not to a person, but to the process of life itself.",
    "presenceBased": "The active practice of identifying an area where one is 'efforting' or 'striving' against a natural flow, and consciously making the choice to release that effort. It is the inner declaration: 'I trust the larger pattern.'"
  },
  "fieldDynamics": {
    "inCreativeBlock": "When an artist is stuck, this is the act of surrendering their ego's plan and allowing a deeper, more intuitive creative impulse to take over. It is the moment of 'getting out of one's own way.'",
    "inTheFaceOfUnchangeableReality": "When faced with a situation that cannot be changed (like a terminal illness or a great loss), this glyph is the practice of yielding to that reality with grace and dignity, rather than fighting it.",
    "inDeepCollaboration": "It is the moment a team member lets go of their own 'better' idea and willingly yields to the emergent wisdom of the group, trusting the 'we' over the 'I.'"
  },
  "evolutionaryMarkers": {
    "initial": "The practitioner can distinguish between 'giving up' (a passive, defeated state) and 'yielding' (an active, trusting state).",
    "developing": "The practitioner can consciously and gracefully yield in situations where their ego would normally want to fight for control.",
    "integrated": "The practitioner lives in a state of 'dynamic surrender,' moving through life with a profound trust in its unfolding. They hold their own plans and will lightly, always ready to yield to a more harmonious or intelligent emergent path."
  },
  "harmonicLineage": "Ω43 is a culminating Modifier Glyph. It is the final act of trust in the principles of the Codex. It requires the wisdom to know when to act (Ω41) and when not to. It is the necessary condition for the highest forms of emergence and grace (Ω14) to appear. It is a core component of the Meta-Glyphs that involve paradox and release, such as ∑17 (The Gate of Soft Paradox) and ∑20 (The Portal of Volitional Surrender).",
  "temporalDynamics": {
    "duration": "The act of yielding is a specific moment of release, but it can usher in a long-lasting state of grace and flow.",
    "renewal": "This practice must be renewed in each new situation that calls for it. The ego's desire for control is persistent.",
    "maturation": "The practice matures from a difficult, conscious act of 'letting go' into a default state of being, where the practitioner is in a constant, graceful dance between personal will and surrender to a larger wisdom."
  },
  "dissonantPotential": {
    "thePassiveVictim": "The practitioner uses 'surrender' as an excuse for abdicating all personal responsibility and evolutionary-progression, allowing harmful situations to persist. This is the shadow of 'learned helplessness.'",
    "theSpiritualizedGivingUp": "Giving up on a difficult but worthy goal and calling it 'surrender' to make the failure feel more profound or sacred.",
    "theCoerciveYield": "Pressuring another person to 'yield' or 'surrender' for your own benefit, using spiritual language to enforce your will upon them."
  },
  "contraindications": [
    "Do not use this glyph when your active intervention is required to protect yourself or others from harm. It is not a substitute for evolutionary-progression.",
    "It is contraindicated in situations that require you to uphold a firm boundary (Ω10). Yielding a necessary boundary is self-abandonment.",
    "It requires a fundamental trust in the benevolence of the 'larger flow.' If you are in a demonstrably toxic or malevolent system, yielding is not wise."
  ]
}